"No,";Time;;Source;Destination;Protocol;Length;Info;;;Time 1;Time 2;;Delay;;Delay 1;Delay 2 ;Jitter
1;0;;"104,22,1,235";"192,168,100,98";TCP;54;"443  >  56799 [FIN, ACK] Seq=1 Ack=1 Win=67 Len=0";;;0;"0,000102";;"0,000102";;"-0,016422";"0,016524";"0,032946"
2;"0,000102";;"192,168,100,98";"104,22,1,235";TCP;54;56799  >  443 [ACK] Seq=1 Ack=4294966412 Win=513 Len=0;;;"0,000102";"0,016626";;"0,016524";;"0,016316";"0,000208";"-0,016108"
3;"0,016626";;"104,22,1,235";"192,168,100,98";TCP;939;"[TCP Retransmission] 443  >  56799 [PSH, ACK] Seq=4294966412 Ack=1 Win=67 Len=885";;;"0,016626";"0,016834";;"0,000208";;"-0,000545";"0,000753";"0,001298"
4;"0,016834";;"192,168,100,98";"104,22,1,235";TCP;54;56799  >  443 [ACK] Seq=1 Ack=2 Win=510 Len=0;;;"0,016834";"0,017587";;"0,000753";;"-0,061211";"0,061964";"0,123175"
5;"0,017587";;"192,168,100,98";"104,22,1,235";TCP;54;"56799  >  443 [FIN, ACK] Seq=1 Ack=2 Win=510 Len=0";;;"0,017587";"0,079551";;"0,061964";;"0,011147";"0,050817";"0,03967"
6;"0,079551";;"192,168,100,98";"104,22,1,235";TCP;66;56800  >  443 [SYN] Seq=0 Win=64240 Len=0 MSS=1460 WS=256 SACK_PERM=1;;;"0,079551";"0,130368";;"0,050817";;"0,050591";"0,000226";"-0,050365"
7;"0,130368";;"104,22,1,235";"192,168,100,98";TCP;66;"443  >  56800 [SYN, ACK] Seq=0 Ack=1 Win=65535 Len=0 MSS=1400 SACK_PERM=1 WS=1024";;;"0,130368";"0,130594";;"0,000226";;"-0,000806";"0,001032";"0,001838"
8;"0,130594";;"192,168,100,98";"104,22,1,235";TCP;54;56800  >  443 [ACK] Seq=1 Ack=1 Win=131584 Len=0;;;"0,130594";"0,131626";;"0,001032";;"-0,003225";"0,004257";"0,007482"
9;"0,131626";;"192,168,100,98";"104,22,1,235";TLSv1;372;Client Hello;;;"0,131626";"0,135883";;"0,004257";;"0,004207";5E-05;"-0,004157"
10;"0,135883";;"104,22,1,235";"192,168,100,98";TCP;54;"[TCP Retransmission] 443  >  56799 [FIN, ACK] Seq=1 Ack=1 Win=67 Len=0";;;"0,135883";"0,135933";;5E-05;;"-0,046984";"0,047034";"0,094018"
11;"0,135933";;"192,168,100,98";"104,22,1,235";TCP;54;[TCP Dup ACK 4#1] 56799  >  443 [ACK] Seq=2 Ack=2 Win=510 Len=0;;;"0,135933";"0,182967";;"0,047034";;"0,033389";"0,013645";"-0,019744"
12;"0,182967";;"104,22,1,235";"192,168,100,98";TCP;54;443  >  56800 [ACK] Seq=1 Ack=319 Win=67584 Len=0;;;"0,182967";"0,196612";;"0,013645";;"0,011428";"0,002217";"-0,009211"
13;"0,196612";;"104,22,1,235";"192,168,100,98";TLSv1;177;"Server Hello, Change Cipher Spec, Encrypted Handshake Message";;;"0,196612";"0,198829";;"0,002217";;"-0,048392";"0,050609";"0,099001"
14;"0,198829";;"192,168,100,98";"104,22,1,235";TLSv1;699;"Change Cipher Spec, Encrypted Handshake Message, Application Data, Application Data";;;"0,198829";"0,249438";;"0,050609";;"0,050505";"0,000104";"-0,050401"
15;"0,249438";;"104,22,1,235";"192,168,100,98";TCP;56;443  >  56800 [ACK] Seq=124 Ack=964 Win=68608 Len=0;;;"0,249438";"0,249542";;"0,000104";;"-0,050182";"0,050286";"0,100468"
16;"0,249542";;"192,168,100,98";"104,22,1,235";TLSv1;160;"Application Data, Application Data";;;"0,249542";"0,299828";;"0,050286";;"0,030645";"0,019641";"-0,011004"
17;"0,299828";;"104,22,1,235";"192,168,100,98";TCP;56;443  >  56800 [ACK] Seq=124 Ack=1070 Win=68608 Len=0;;;"0,299828";"0,319469";;"0,019641";;"-0,188595";"0,208236";"0,396831"
18;"0,319469";;"192,168,100,98";"104,22,1,235";TCP;54;"[TCP Retransmission] 56799  >  443 [FIN, ACK] Seq=1 Ack=2 Win=510 Len=0";;;"0,319469";"0,527705";;"0,208236";;"0,208132";"0,000104";"-0,208028"
19;"0,527705";;"104,22,1,235";"192,168,100,98";TCP;54;"[TCP Previous segment not captured] 443  >  56800 [FIN, ACK] Seq=1025 Ack=1070 Win=68608 Len=0";;;"0,527705";"0,527809";;"0,000104";;"-0,019008";"0,019112";"0,03812"
20;"0,527809";;"192,168,100,98";"104,22,1,235";TCP;54;[TCP Dup ACK 14#1] 56800  >  443 [ACK] Seq=1070 Ack=124 Win=131328 Len=0;;;"0,527809";"0,546921";;"0,019112";;"0,018922";"0,00019";"-0,018732"
21;"0,546921";;"104,22,1,235";"192,168,100,98";TCP;955;"[TCP Out-Of-Order] 443  >  56800 [PSH, ACK] Seq=124 Ack=1070 Win=68608 Len=901";;;"0,546921";"0,547111";;"0,00019";;"-0,000504";"0,000694";"0,001198"
22;"0,547111";;"192,168,100,98";"104,22,1,235";TCP;54;56800  >  443 [ACK] Seq=1070 Ack=1026 Win=130560 Len=0;;;"0,547111";"0,547805";;"0,000694";;"-0,044789";"0,045483";"0,090272"
23;"0,547805";;"192,168,100,98";"104,22,1,235";TCP;54;"56800  >  443 [FIN, ACK] Seq=1070 Ack=1026 Win=130560 Len=0";;;"0,547805";"0,593288";;"0,045483";;"0,036702";"0,008781";"-0,027921"
24;"0,593288";;"192,168,100,98";"104,22,1,235";TCP;66;56801  >  443 [SYN] Seq=0 Win=64240 Len=0 MSS=1460 WS=256 SACK_PERM=1;;;"0,593288";"0,602069";;"0,008781";;"-0,04937";"0,058151";"0,107521"
25;"0,602069";;"104,22,1,235";"192,168,100,98";TCP;56;443  >  56800 [ACK] Seq=1026 Ack=1071 Win=68608 Len=0;;;"0,602069";"0,66022";;"0,058151";;"0,05793";"0,000221";"-0,057709"
27;"0,66022";;"104,22,1,235";"192,168,100,98";TCP;66;"443  >  56801 [SYN, ACK] Seq=0 Ack=1 Win=65535 Len=0 MSS=1400 SACK_PERM=1 WS=1024";;;"0,66022";"0,660441";;"0,000221";;"-0,000778";"0,000999";"0,001777"
28;"0,660441";;"192,168,100,98";"104,22,1,235";TCP;54;56801  >  443 [ACK] Seq=1 Ack=1 Win=131584 Len=0;;;"0,660441";"0,66144";;"0,000999";;"-0,05824";"0,059239";"0,117479"
29;"0,66144";;"192,168,100,98";"104,22,1,235";TLSv1;372;Client Hello;;;"0,66144";"0,720679";;"0,059239";;"0,043574";"0,015665";"-0,027909"
30;"0,720679";;"104,22,1,235";"192,168,100,98";TCP;54;443  >  56801 [ACK] Seq=1 Ack=319 Win=67584 Len=0;;;"0,720679";"0,736344";;"0,015665";;"0,014533";"0,001132";"-0,013401"
31;"0,736344";;"104,22,1,235";"192,168,100,98";TLSv1;177;"Server Hello, Change Cipher Spec, Encrypted Handshake Message";;;"0,736344";"0,737476";;"0,001132";;"-0,058263";"0,059395";"0,117658"
32;"0,737476";;"192,168,100,98";"104,22,1,235";TLSv1;699;"Change Cipher Spec, Encrypted Handshake Message, Application Data, Application Data";;;"0,737476";"0,796871";;"0,059395";;"0,059319";"7,6E-05";"-0,059243"
33;"0,796871";;"104,22,1,235";"192,168,100,98";TCP;56;443  >  56801 [ACK] Seq=124 Ack=964 Win=68608 Len=0;;;"0,796871";"0,796947";;"7,6E-05";;"-0,059088";"0,059164";"0,118252"
34;"0,796947";;"192,168,100,98";"104,22,1,235";TLSv1;160;"Application Data, Application Data";;;"0,796947";"0,856111";;"0,059164";;"-0,006415";"0,065579";"0,071994"
35;"0,856111";;"104,22,1,235";"192,168,100,98";TCP;56;443  >  56801 [ACK] Seq=124 Ack=1070 Win=68608 Len=0;;;"0,856111";"0,92169";;"0,065579";;"0,001597";"0,063982";"0,062385"
37;"0,92169";;"192,168,100,98";"104,22,1,235";TCP;54;"[TCP Retransmission] 56799  >  443 [FIN, ACK] Seq=1 Ack=2 Win=510 Len=0";;;"0,92169";"0,985672";;"0,063982";;"-0,053432";"0,117414";"0,170846"
38;"0,985672";;"104,22,1,235";"192,168,100,98";TCP;56;443  >  56799 [ACK] Seq=2 Ack=2 Win=67 Len=0;;;"0,985672";"1,103086";;"0,117414";;"0,117304";"0,00011";"-0,117194"
39;1.103.086;"1,103086";"104,22,1,235";"192,168,100,98";TCP;54;"[TCP Previous segment not captured] 443  >  56801 [FIN, ACK] Seq=1025 Ack=1070 Win=68608 Len=0";;;"1,103086";"1,103196";;"0,00011";;"-0,01325";"0,01336";"0,02661"
40;1.103.196;"1,103196";"192,168,100,98";"104,22,1,235";TCP;54;[TCP Dup ACK 32#1] 56801  >  443 [ACK] Seq=1070 Ack=124 Win=131328 Len=0;;;"1,103196";"1,116556";;"0,01336";;"0,013159";"0,000201";"-0,012958"
41;1.116.556;"1,116556";"104,22,1,235";"192,168,100,98";TCP;955;"[TCP Out-Of-Order] 443  >  56801 [PSH, ACK] Seq=124 Ack=1070 Win=68608 Len=901";;;"1,116556";"1,116757";;"0,000201";;"-0,000598";"0,000799";"0,001397"
42;1.116.757;"1,116757";"192,168,100,98";"104,22,1,235";TCP;54;56801  >  443 [ACK] Seq=1070 Ack=1026 Win=130560 Len=0;;;"1,116757";"1,117556";;"0,000799";;"-0,062142";"0,062941";"0,125083"
43;1.117.556;"1,117556";"192,168,100,98";"104,22,1,235";TCP;54;"56801  >  443 [FIN, ACK] Seq=1070 Ack=1026 Win=130560 Len=0";;;"1,117556";"1,180497";;"0,062941";;"0,059216";"0,003725";"-0,055491"
45;1.180.497;"1,180497";"104,22,1,235";"192,168,100,98";TCP;56;443  >  56801 [ACK] Seq=1026 Ack=1071 Win=68608 Len=0;;;"1,180497";"1,184222";;"0,003725";;"-0,076617";"0,080342";"0,156959"
46;1.184.222;"1,184222";"192,168,100,98";"104,22,1,235";TCP;66;56802  >  443 [SYN] Seq=0 Win=64240 Len=0 MSS=1460 WS=256 SACK_PERM=1;;;"1,184222";"1,264564";;"0,080342";;"0,080105";"0,000237";"-0,079868"
47;1.264.564;"1,264564";"104,22,1,235";"192,168,100,98";TCP;66;"443  >  56802 [SYN, ACK] Seq=0 Ack=1 Win=65535 Len=0 MSS=1400 SACK_PERM=1 WS=1024";;;"1,264564";"1,264801";;"0,000237";;"-0,00071";"0,000947";"0,001657"
48;1.264.801;"1,264801";"192,168,100,98";"104,22,1,235";TCP;54;56802  >  443 [ACK] Seq=1 Ack=1 Win=131584 Len=0;;;"1,264801";"1,265748";;"0,000947";;"-0,089351";"0,090298";"0,179649"
49;1.265.748;"1,265748";"192,168,100,98";"104,22,1,235";TLSv1;372;Client Hello;;;"1,265748";"1,356046";;"0,090298";;"0,067216";"0,023082";"-0,044134"
50;1.356.046;"1,356046";"104,22,1,235";"192,168,100,98";TCP;54;443  >  56802 [ACK] Seq=1 Ack=319 Win=67584 Len=0;;;"1,356046";"1,379128";;"0,023082";;"0,020915";"0,002167";"-0,018748"
51;1.379.128;"1,379128";"104,22,1,235";"192,168,100,98";TLSv1;177;"Server Hello, Change Cipher Spec, Encrypted Handshake Message";;;"1,379128";"1,381295";;"0,002167";;"-0,067582";"0,069749";"0,137331"
52;1.381.295;"1,381295";"192,168,100,98";"104,22,1,235";TLSv1;699;"Change Cipher Spec, Encrypted Handshake Message, Application Data, Application Data";;;"1,381295";"1,451044";;"0,069749";;"0,069643";"0,000106";"-0,069537"
54;1.451.044;"1,451044";"104,22,1,235";"192,168,100,98";TCP;56;443  >  56802 [ACK] Seq=124 Ack=964 Win=68608 Len=0;;;"1,451044";"1,451150";;"0,000106";;"-0,059281";"0,059387";"0,118668"
55;1.451.150;"1,451150";"192,168,100,98";"104,22,1,235";TLSv1;160;"Application Data, Application Data";;;"1,451150";"1,510537";;"0,059387";;"-0,170964";"0,230351";"0,401315"
56;1.510.537;"1,510537";"104,22,1,235";"192,168,100,98";TCP;56;443  >  56802 [ACK] Seq=124 Ack=1070 Win=68608 Len=0;;;"1,510537";"1,740888";;"0,230351";;"0,230229";"0,000122";"-0,230107"
58;1.740.888;"1,740888";"104,22,1,235";"192,168,100,98";TCP;54;"[TCP Previous segment not captured] 443  >  56802 [FIN, ACK] Seq=1025 Ack=1070 Win=68608 Len=0";;;"1,740888";"1,741010";;"0,000122";;"-0,015518";"0,01564";"0,031158"
59;1.741.010;"1,741010";"192,168,100,98";"104,22,1,235";TCP;54;[TCP Dup ACK 52#1] 56802  >  443 [ACK] Seq=1070 Ack=124 Win=131328 Len=0;;;"1,741010";"1,756650";;"0,01564";;"0,015436";"0,000204";"-0,015232"
60;1.756.650;"1,756650";"104,22,1,235";"192,168,100,98";TCP;955;"[TCP Out-Of-Order] 443  >  56802 [PSH, ACK] Seq=124 Ack=1070 Win=68608 Len=901";;;"1,756650";"1,756854";;"0,000204";;"-0,000565";"0,000769";"0,001334"
61;1.756.854;"1,756854";"192,168,100,98";"104,22,1,235";TCP;54;56802  >  443 [ACK] Seq=1070 Ack=1026 Win=130560 Len=0;;;"1,756854";"1,757623";;"0,000769";;"-0,051848";"0,052617";"0,104465"
62;1.757.623;"1,757623";"192,168,100,98";"104,22,1,235";TCP;54;"56802  >  443 [FIN, ACK] Seq=1070 Ack=1026 Win=130560 Len=0";;;"1,757623";"1,810240";;"0,052617";;"0,006968";"0,045649";"0,038681"
63;1.810.240;"1,810240";"192,168,100,98";"104,22,1,235";TCP;66;56803  >  443 [SYN] Seq=0 Win=64240 Len=0 MSS=1460 WS=256 SACK_PERM=1;;;"1,810240";"1,855889";;"0,045649";;"-0,009523";"0,055172";"0,064695"
64;1.855.889;"1,855889";"104,22,1,235";"192,168,100,98";TCP;56;443  >  56802 [ACK] Seq=1026 Ack=1071 Win=68608 Len=0;;;"1,855889";"1,911061";;"0,055172";;"0,054929";"0,000243";"-0,054686"
65;1.911.061;"1,911061";"104,22,1,235";"192,168,100,98";TCP;66;"443  >  56803 [SYN, ACK] Seq=0 Ack=1 Win=65535 Len=0 MSS=1400 SACK_PERM=1 WS=1024";;;"1,911061";"1,911304";;"0,000243";;"-0,000749";"0,000992";"0,001741"
66;1.911.304;"1,911304";"192,168,100,98";"104,22,1,235";TCP;54;56803  >  443 [ACK] Seq=1 Ack=1 Win=131584 Len=0;;;"1,911304";"1,912296";;"0,000992";;"-0,106283";"0,107275";"0,213558"
67;1.912.296;"1,912296";"192,168,100,98";"104,22,1,235";TLSv1;372;Client Hello;;;"1,912296";"2,019571";;"0,107275";;"0,097362";"0,009913";"-0,087449"
69;2.019.571;"2,019571";"104,22,1,235";"192,168,100,98";TCP;54;443  >  56803 [ACK] Seq=1 Ack=319 Win=67584 Len=0;;;"2,019571";"2,029484";;"0,009913";;"0,007976";"0,001937";"-0,006039"
70;2.029.484;"2,029484";"104,22,1,235";"192,168,100,98";TLSv1;177;"Server Hello, Change Cipher Spec, Encrypted Handshake Message";;;"2,029484";"2,031421";;"0,001937";;"-0,102792";"0,104729";"0,207521"
72;2.031.421;"2,031421";"192,168,100,98";"104,22,1,235";TLSv1;699;"Change Cipher Spec, Encrypted Handshake Message, Application Data, Application Data";;;"2,031421";"2,136150";;"0,104729";;"0,104628";"0,000101";"-0,104527"
73;2.136.150;"2,136150";"104,22,1,235";"192,168,100,98";TCP;56;443  >  56803 [ACK] Seq=124 Ack=964 Win=68608 Len=0;;;"2,136150";"2,136251";;"0,000101";;"-0,081573";"0,081674";"0,163247"
74;2.136.251;"2,136251";"192,168,100,98";"104,22,1,235";TLSv1;160;"Application Data, Application Data";;;"2,136251";"2,217925";;"0,081674";;"-0,127147";"0,208821";"0,335968"
76;2.217.925;"2,217925";"104,22,1,235";"192,168,100,98";TCP;56;443  >  56803 [ACK] Seq=124 Ack=1070 Win=68608 Len=0;;;"2,217925";"2,426746";;"0,208821";;"0,208703";"0,000118";"-0,208585"
77;2.426.746;"2,426746";"104,22,1,235";"192,168,100,98";TCP;54;"[TCP Previous segment not captured] 443  >  56803 [FIN, ACK] Seq=1025 Ack=1070 Win=68608 Len=0";;;"2,426746";"2,426864";;"0,000118";;"-0,019742";"0,01986";"0,039602"
78;2.426.864;"2,426864";"192,168,100,98";"104,22,1,235";TCP;54;[TCP Dup ACK 72#1] 56803  >  443 [ACK] Seq=1070 Ack=124 Win=131328 Len=0;;;"2,426864";"2,446724";;"0,01986";;"0,019682";"0,000178";"-0,019504"
80;2.446.724;"2,446724";"104,22,1,235";"192,168,100,98";TCP;955;"[TCP Out-Of-Order] 443  >  56803 [PSH, ACK] Seq=124 Ack=1070 Win=68608 Len=901";;;"2,446724";"2,446902";;"0,000178";;"-0,000762";"0,00094";"0,001702"
81;2.446.902;"2,446902";"192,168,100,98";"104,22,1,235";TCP;54;56803  >  443 [ACK] Seq=1070 Ack=1026 Win=130560 Len=0;;;"2,446902";"2,447842";;"0,00094";;"-0,041895";"0,042835";"0,08473"
82;2.447.842;"2,447842";"192,168,100,98";"104,22,1,235";TCP;54;"56803  >  443 [FIN, ACK] Seq=1070 Ack=1026 Win=130560 Len=0";;;"2,447842";"2,490677";;"0,042835";;"-0,03585";"0,078685";"0,114535"
83;2.490.677;"2,490677";"192,168,100,98";"104,22,1,235";TCP;66;56804  >  443 [SYN] Seq=0 Win=64240 Len=0 MSS=1460 WS=256 SACK_PERM=1;;;"2,490677";"2,569362";;"0,078685";;"0,054322";"0,024363";"-0,029959"
84;2.569.362;"2,569362";"104,22,1,235";"192,168,100,98";TCP;56;443  >  56803 [ACK] Seq=1026 Ack=1071 Win=68608 Len=0;;;"2,569362";"2,593725";;"0,024363";;"0,023969";"0,000394";"-0,023575"
85;2.593.725;"2,593725";"192,168,100,98";"74,125,68,91";"TLSv1,2";805;Application Data;;;"2,593725";"2,594119";;"0,000394";;"-0,026329";"0,026723";"0,053052"
86;2.594.119;"2,594119";"192,168,100,98";"74,125,68,91";"TLSv1,2";93;Application Data;;;"2,594119";"2,620842";;"0,026723";;"0,02647";"0,000253";"-0,026217"
87;2.620.842;"2,620842";"104,22,1,235";"192,168,100,98";TCP;66;"443  >  56804 [SYN, ACK] Seq=0 Ack=1 Win=65535 Len=0 MSS=1400 SACK_PERM=1 WS=1024";;;"2,620842";"2,621095";;"0,000253";;"-0,000758";"0,001011";"0,001769"
88;2.621.095;"2,621095";"192,168,100,98";"104,22,1,235";TCP;54;56804  >  443 [ACK] Seq=1 Ack=1 Win=131584 Len=0;;;"2,621095";"2,622106";;"0,001011";;"-0,142155";"0,143166";"0,285321"
89;2.622.106;"2,622106";"192,168,100,98";"104,22,1,235";TLSv1;372;Client Hello;;;"2,622106";"2,765272";;"0,143166";;"0,128936";"0,01423";"-0,114706"
91;2.765.272;"2,765272";"192,168,100,98";"74,125,68,119";TCP;55;56446  >  443 [ACK] Seq=1 Ack=1 Win=2051 Len=1 [TCP segment of a reassembled PDU];;;"2,765272";"2,779502";;"0,01423";;"-0,031001";"0,045231";"0,076232"
92;2.779.502;"2,779502";"74,125,68,119";"192,168,100,98";TCP;66;443  >  56446 [ACK] Seq=1 Ack=2 Win=443 Len=0 SLE=1 SRE=2;;;"2,779502";"2,824733";;"0,045231";;"-0,134242";"0,179473";"0,313715"
93;2.824.733;"2,824733";"192,168,100,98";"74,125,68,91";TCP;844;"[TCP Retransmission] 56441  >  443 [PSH, ACK] Seq=1 Ack=1 Win=4134 Len=790";;;"2,824733";"3,004206";;"0,179473";;"0,118877";"0,060596";"-0,058281"
95;3.004.206;"3,004206";"192,168,100,98";"104,22,1,235";TCP;372;"[TCP Retransmission] 56804  >  443 [PSH, ACK] Seq=1 Ack=1 Win=131584 Len=318";;;"3,004206";"3,064802";;"0,060596";;"0,048958";"0,011638";"-0,03732"
96;3.064.802;"3,064802";"104,22,1,235";"192,168,100,98";TCP;54;443  >  56804 [ACK] Seq=1 Ack=319 Win=67584 Len=0;;;"3,064802";"3,076440";;"0,011638";;"0,009885";"0,001753";"-0,008132"
97;3.076.440;"3,076440";"104,22,1,235";"192,168,100,98";TLSv1;177;"Server Hello, Change Cipher Spec, Encrypted Handshake Message";;;"3,076440";"3,078193";;"0,001753";;"-0,049513";"0,051266";"0,100779"
98;3.078.193;"3,078193";"192,168,100,98";"104,22,1,235";TLSv1;699;"Change Cipher Spec, Encrypted Handshake Message, Application Data, Application Data";;;"3,078193";"3,129459";;"0,051266";;"0,042331";"0,008935";"-0,033396"
99;3.129.459;"3,129459";"192,168,100,98";"74,125,68,91";TCP;844;"[TCP Retransmission] 56441  >  443 [PSH, ACK] Seq=1 Ack=1 Win=4134 Len=790";;;"3,129459";"3,138394";;"0,008935";;"0,008851";"8,4E-05";"-0,008767"
100;3.138.394;"3,138394";"104,22,1,235";"192,168,100,98";TCP;56;443  >  56804 [ACK] Seq=124 Ack=964 Win=68608 Len=0;;;"3,138394";"3,138478";;"8,4E-05";;"-0,056905";"0,056989";"0,113894"
101;3.138.478;"3,138478";"192,168,100,98";"104,22,1,235";TLSv1;160;"Application Data, Application Data";;;"3,138478";"3,195467";;"0,056989";;"-0,181726";"0,238715";"0,420441"
102;3.195.467;"3,195467";"104,22,1,235";"192,168,100,98";TCP;56;443  >  56804 [ACK] Seq=124 Ack=1070 Win=68608 Len=0;;;"3,195467";"3,434182";;"0,238715";;"0,238602";"0,000113";"-0,238489"
104;3.434.182;"3,434182";"104,22,1,235";"192,168,100,98";TCP;54;"[TCP Previous segment not captured] 443  >  56804 [FIN, ACK] Seq=1009 Ack=1070 Win=68608 Len=0";;;"3,434182";"3,434295";;"0,000113";;"-0,011873";"0,011986";"0,023859"
105;3.434.295;"3,434295";"192,168,100,98";"104,22,1,235";TCP;54;[TCP Dup ACK 98#1] 56804  >  443 [ACK] Seq=1070 Ack=124 Win=131328 Len=0;;;"3,434295";"3,446281";;"0,011986";;"0,011882";"0,000104";"-0,011778"
106;3.446.281;"3,446281";"104,22,1,235";"192,168,100,98";TCP;939;"[TCP Out-Of-Order] 443  >  56804 [PSH, ACK] Seq=124 Ack=1070 Win=68608 Len=885";;;"3,446281";"3,446385";;"0,000104";;"-0,00035";"0,000454";"0,000804"
107;3.446.385;"3,446385";"192,168,100,98";"104,22,1,235";TCP;54;56804  >  443 [ACK] Seq=1070 Ack=1010 Win=130560 Len=0;;;"3,446385";"3,446839";;"0,000454";;"-0,040079";"0,040533";"0,080612"
108;3.446.839;"3,446839";"192,168,100,98";"104,22,1,235";TCP;54;"56804  >  443 [FIN, ACK] Seq=1070 Ack=1010 Win=130560 Len=0";;;"3,446839";"3,487372";;"0,040533";;"0,022596";"0,017937";"-0,004659"
110;3.487.372;"3,487372";"192,168,100,98";"104,22,1,235";TCP;66;56805  >  443 [SYN] Seq=0 Win=64240 Len=0 MSS=1460 WS=256 SACK_PERM=1;;;"3,487372";"3,505309";;"0,017937";;"-0,016328";"0,034265";"0,050593"
111;3.505.309;"3,505309";"104,22,1,235";"192,168,100,98";TCP;56;443  >  56804 [ACK] Seq=1010 Ack=1071 Win=68608 Len=0;;;"3,505309";"3,539574";;"0,034265";;"0,034027";"0,000238";"-0,033789"
112;3.539.574;"3,539574";"104,22,1,235";"192,168,100,98";TCP;66;"443  >  56805 [SYN, ACK] Seq=0 Ack=1 Win=65535 Len=0 MSS=1400 SACK_PERM=1 WS=1024";;;"3,539574";"3,539812";;"0,000238";;"-0,000712";"0,00095";"0,001662"
113;3.539.812;"3,539812";"192,168,100,98";"104,22,1,235";TCP;54;56805  >  443 [ACK] Seq=1 Ack=1 Win=131584 Len=0;;;"3,539812";"3,540762";;"0,00095";;"-0,049779";"0,050729";"0,100508"
114;3.540.762;"3,540762";"192,168,100,98";"104,22,1,235";TLSv1;372;Client Hello;;;"3,540762";"3,591491";;"0,050729";;"0,033349";"0,01738";"-0,015969"
115;3.591.491;"3,591491";"104,22,1,235";"192,168,100,98";TCP;54;443  >  56805 [ACK] Seq=1 Ack=319 Win=67584 Len=0;;;"3,591491";"3,608871";;"0,01738";;"0,015097";"0,002283";"-0,012814"
116;3.608.871;"3,608871";"104,22,1,235";"192,168,100,98";TLSv1;177;"Server Hello, Change Cipher Spec, Encrypted Handshake Message";;;"3,608871";"3,611154";;"0,002283";;"-0,048561";"0,050844";"0,099405"
117;3.611.154;"3,611154";"192,168,100,98";"104,22,1,235";TLSv1;699;"Change Cipher Spec, Encrypted Handshake Message, Application Data, Application Data";;;"3,611154";"3,661998";;"0,050844";;"0,050727";"0,000117";"-0,05061"
118;3.661.998;"3,661998";"104,22,1,235";"192,168,100,98";TCP;56;443  >  56805 [ACK] Seq=124 Ack=964 Win=68608 Len=0;;;"3,661998";"3,662115";;"0,000117";;"-0,049646";"0,049763";"0,099409"
119;3.662.115;"3,662115";"192,168,100,98";"104,22,1,235";TLSv1;160;"Application Data, Application Data";;;"3,662115";"3,711878";;"0,049763";;"0,03016";"0,019603";"-0,010557"
120;3.711.878;"3,711878";"104,22,1,235";"192,168,100,98";TCP;56;443  >  56805 [ACK] Seq=124 Ack=1070 Win=68608 Len=0;;;"3,711878";"3,731481";;"0,019603";;"0,0031";"0,016503";"0,013403"
121;3.731.481;"3,731481";"192,168,100,98";"74,125,68,91";TCP;844;"[TCP Retransmission] 56441  >  443 [PSH, ACK] Seq=1 Ack=1 Win=4134 Len=790";;;"3,731481";"3,747984";;"0,016503";;"0,014556";"0,001947";"-0,012609"
122;3.747.984;"3,747984";"74,125,68,91";"192,168,100,98";TCP;54;443  >  56441 [ACK] Seq=1 Ack=791 Win=1640 Len=0;;;"3,747984";"3,749931";;"0,001947";;"0,001947";0;"-0,001947"
123;3.749.931;"3,749931";"74,125,68,91";"192,168,100,98";"TLSv1,2";93;Application Data;;;"3,749931";"3,749931";;0;;"-0,000133";"0,000133";"0,000266"
124;3.749.931;"3,749931";"74,125,68,91";"192,168,100,98";"TLSv1,2";125;Application Data;;;"3,749931";"3,750064";;"0,000133";;"-0,016916";"0,017049";"0,033965"
125;3.750.064;"3,750064";"192,168,100,98";"74,125,68,91";TCP;54;56441  >  443 [ACK] Seq=791 Ack=111 Win=4134 Len=0;;;"3,750064";"3,767113";;"0,017049";;"0,017049";0;"-0,017049"
126;3.767.113;"3,767113";"74,125,68,91";"192,168,100,98";"TLSv1,2";85;Application Data;;;"3,767113";"3,767113";;0;;"-0,000198";"0,000198";"0,000396"
127;3.767.113;"3,767113";"74,125,68,91";"192,168,100,98";"TLSv1,2";93;Application Data;;;"3,767113";"3,767311";;"0,000198";;"-0,000574";"0,000772";"0,001346"
128;3.767.311;"3,767311";"192,168,100,98";"74,125,68,91";TCP;54;56441  >  443 [ACK] Seq=791 Ack=181 Win=4133 Len=0;;;"3,767311";"3,768083";;"0,000772";;"-0,017834";"0,018606";"0,03644"
129;3.768.083;"3,768083";"192,168,100,98";"74,125,68,91";"TLSv1,2";93;Application Data;;;"3,768083";"3,786689";;"0,018606";;"-0,125835";"0,144441";"0,270276"
130;3.786.689;"3,786689";"74,125,68,91";"192,168,100,98";TCP;56;443  >  56441 [ACK] Seq=181 Ack=830 Win=1640 Len=0;;;"3,786689";"3,931130";;"0,144441";;"0,144306";"0,000135";"-0,144171"
131;3.931.130;"3,931130";"104,22,1,235";"192,168,100,98";TCP;54;"[TCP Previous segment not captured] 443  >  56805 [FIN, ACK] Seq=1025 Ack=1070 Win=68608 Len=0";;;"3,931130";"3,931265";;"0,000135";;"-0,014986";"0,015121";"0,030107"
132;3.931.265;"3,931265";"192,168,100,98";"104,22,1,235";TCP;54;[TCP Dup ACK 117#1] 56805  >  443 [ACK] Seq=1070 Ack=124 Win=131328 Len=0;;;"3,931265";"3,946386";;"0,015121";;"0,01491";"0,000211";"-0,014699"
133;3.946.386;"3,946386";"104,22,1,235";"192,168,100,98";TCP;955;"[TCP Out-Of-Order] 443  >  56805 [PSH, ACK] Seq=124 Ack=1070 Win=68608 Len=901";;;"3,946386";"3,946597";;"0,000211";;"-0,001316";"0,001527";"0,002843"
134;3.946.597;"3,946597";"192,168,100,98";"104,22,1,235";TCP;54;56805  >  443 [ACK] Seq=1070 Ack=1026 Win=130560 Len=0;;;"3,946597";"3,948124";;"0,001527";;"-0,048017";"0,049544";"0,097561"
135;3.948.124;"3,948124";"192,168,100,98";"104,22,1,235";TCP;54;"56805  >  443 [FIN, ACK] Seq=1070 Ack=1026 Win=130560 Len=0";;;"3,948124";"3,997668";;"0,049544";;"0,007089";"0,042455";"0,035366"
136;3.997.668;"3,997668";"104,22,1,235";"192,168,100,98";TCP;56;443  >  56805 [ACK] Seq=1026 Ack=1071 Win=68608 Len=0;;;"3,997668";"4,040123";;"0,042455";;"-0,008512";"0,050967";"0,059479"
137;4.040.123;"4,040123";"192,168,100,98";"104,22,1,235";TCP;66;56806  >  443 [SYN] Seq=0 Win=64240 Len=0 MSS=1460 WS=256 SACK_PERM=1;;;"4,040123";"4,091090";;"0,050967";;"0,050825";"0,000142";"-0,050683"
138;4.091.090;"4,091090";"104,22,1,235";"192,168,100,98";TCP;66;"443  >  56806 [SYN, ACK] Seq=0 Ack=1 Win=65535 Len=0 MSS=1400 SACK_PERM=1 WS=1024";;;"4,091090";"4,091232";;"0,000142";;"-0,000985";"0,001127";"0,002112"
139;4.091.232;"4,091232";"192,168,100,98";"104,22,1,235";TCP;54;56806  >  443 [ACK] Seq=1 Ack=1 Win=131584 Len=0;;;"4,091232";"4,092359";;"0,001127";;"-0,051517";"0,052644";"0,104161"
140;4.092.359;"4,092359";"192,168,100,98";"104,22,1,235";TLSv1;372;Client Hello;;;"4,092359";"4,145003";;"0,052644";;"0,041335";"0,011309";"-0,030026"
141;4.145.003;"4,145003";"104,22,1,235";"192,168,100,98";TCP;54;443  >  56806 [ACK] Seq=1 Ack=319 Win=67584 Len=0;;;"4,145003";"4,156312";;"0,011309";;"0,009235";"0,002074";"-0,007161"
142;4.156.312;"4,156312";"104,22,1,235";"192,168,100,98";TLSv1;177;"Server Hello, Change Cipher Spec, Encrypted Handshake Message";;;"4,156312";"4,158386";;"0,002074";;"-0,047972";"0,050046";"0,098018"
143;4.158.386;"4,158386";"192,168,100,98";"104,22,1,235";TLSv1;699;"Change Cipher Spec, Encrypted Handshake Message, Application Data, Application Data";;;"4,158386";"4,208432";;"0,050046";;"0,049941";"0,000105";"-0,049836"
144;4.208.432;"4,208432";"104,22,1,235";"192,168,100,98";TCP;56;443  >  56806 [ACK] Seq=124 Ack=964 Win=68608 Len=0;;;"4,208432";"4,208537";;"0,000105";;"-0,086964";"0,087069";"0,174033"
145;4.208.537;"4,208537";"192,168,100,98";"104,22,1,235";TLSv1;160;"Application Data, Application Data";;;"4,208537";"4,295606";;"0,087069";;"-0,136091";"0,22316";"0,359251"
146;4.295.606;"4,295606";"104,22,1,235";"192,168,100,98";TCP;56;443  >  56806 [ACK] Seq=124 Ack=1070 Win=68608 Len=0;;;"4,295606";"4,518766";;"0,22316";;"0,223043";"0,000117";"-0,222926"
147;4.518.766;"4,518766";"104,22,1,235";"192,168,100,98";TCP;54;"[TCP Previous segment not captured] 443  >  56806 [FIN, ACK] Seq=1025 Ack=1070 Win=68608 Len=0";;;"4,518766";"4,518883";;"0,000117";;"-0,018109";"0,018226";"0,036335"
148;4.518.883;"4,518883";"192,168,100,98";"104,22,1,235";TCP;54;[TCP Dup ACK 143#1] 56806  >  443 [ACK] Seq=1070 Ack=124 Win=131328 Len=0;;;"4,518883";"4,537109";;"0,018226";;"0,018038";"0,000188";"-0,01785"
149;4.537.109;"4,537109";"104,22,1,235";"192,168,100,98";TCP;955;"[TCP Out-Of-Order] 443  >  56806 [PSH, ACK] Seq=124 Ack=1070 Win=68608 Len=901";;;"4,537109";"4,537297";;"0,000188";;"-0,000548";"0,000736";"0,001284"
150;4.537.297;"4,537297";"192,168,100,98";"104,22,1,235";TCP;54;56806  >  443 [ACK] Seq=1070 Ack=1026 Win=130560 Len=0;;;"4,537297";"4,538033";;"0,000736";;"-0,048863";"0,049599";"0,098462"
151;4.538.033;"4,538033";"192,168,100,98";"104,22,1,235";TCP;54;"56806  >  443 [FIN, ACK] Seq=1070 Ack=1026 Win=130560 Len=0";;;"4,538033";"4,587632";;"0,049599";;"0,023407";"0,026192";"0,002785"
152;4.587.632;"4,587632";"104,22,1,235";"192,168,100,98";TCP;56;443  >  56806 [ACK] Seq=1026 Ack=1071 Win=68608 Len=0;;;"4,587632";"4,613824";;"0,026192";;"-0,022612";"0,048804";"0,071416"
153;4.613.824;"4,613824";"192,168,100,98";"104,22,1,235";TCP;66;56807  >  443 [SYN] Seq=0 Win=64240 Len=0 MSS=1460 WS=256 SACK_PERM=1;;;"4,613824";"4,662628";;"0,048804";;"0,048445";"0,000359";"-0,048086"
154;4.662.628;"4,662628";"104,22,1,235";"192,168,100,98";TCP;66;"443  >  56807 [SYN, ACK] Seq=0 Ack=1 Win=65535 Len=0 MSS=1400 SACK_PERM=1 WS=1024";;;"4,662628";"4,662987";;"0,000359";;"-0,000659";"0,001018";"0,001677"
155;4.662.987;"4,662987";"192,168,100,98";"104,22,1,235";TCP;54;56807  >  443 [ACK] Seq=1 Ack=1 Win=131584 Len=0;;;"4,662987";"4,664005";;"0,001018";;"-0,048456";"0,049474";"0,09793"
156;4.664.005;"4,664005";"192,168,100,98";"104,22,1,235";TLSv1;372;Client Hello;;;"4,664005";"4,713479";;"0,049474";;"0,032681";"0,016793";"-0,015888"
157;4.713.479;"4,713479";"104,22,1,235";"192,168,100,98";TCP;54;443  >  56807 [ACK] Seq=1 Ack=319 Win=67584 Len=0;;;"4,713479";"4,730272";;"0,016793";;"0,015051";"0,001742";"-0,013309"
158;4.730.272;"4,730272";"104,22,1,235";"192,168,100,98";TLSv1;177;"Server Hello, Change Cipher Spec, Encrypted Handshake Message";;;"4,730272";"4,732014";;"0,001742";;"-0,047019";"0,048761";"0,09578"
159;4.732.014;"4,732014";"192,168,100,98";"104,22,1,235";TLSv1;699;"Change Cipher Spec, Encrypted Handshake Message, Application Data, Application Data";;;"4,732014";"4,780775";;"0,048761";;"0,048663";"9,8E-05";"-0,048565"
160;4.780.775;"4,780775";"104,22,1,235";"192,168,100,98";TCP;56;443  >  56807 [ACK] Seq=124 Ack=964 Win=68608 Len=0;;;"4,780775";"4,780873";;"9,8E-05";;"-0,047963";"0,048061";"0,096024"
161;4.780.873;"4,780873";"192,168,100,98";"104,22,1,235";TLSv1;160;"Application Data, Application Data";;;"4,780873";"4,828934";;"0,048061";;"-0,184862";"0,232923";"0,417785"
162;4.828.934;"4,828934";"104,22,1,235";"192,168,100,98";TCP;56;443  >  56807 [ACK] Seq=124 Ack=1070 Win=68608 Len=0;;;"4,828934";"5,061857";;"0,232923";;"0,232749";"0,000174";"-0,232575"
163;5.061.857;"5,061857";"104,22,1,235";"192,168,100,98";TCP;54;"[TCP Previous segment not captured] 443  >  56807 [FIN, ACK] Seq=1025 Ack=1070 Win=68608 Len=0";;;"5,061857";"5,062031";;"0,000174";;"-0,01754";"0,017714";"0,035254"
164;5.062.031;"5,062031";"192,168,100,98";"104,22,1,235";TCP;54;[TCP Dup ACK 159#1] 56807  >  443 [ACK] Seq=1070 Ack=124 Win=131328 Len=0;;;"5,062031";"5,079745";;"0,017714";;"0,017542";"0,000172";"-0,01737"
165;5.079.745;"5,079745";"104,22,1,235";"192,168,100,98";TCP;955;"[TCP Out-Of-Order] 443  >  56807 [PSH, ACK] Seq=124 Ack=1070 Win=68608 Len=901";;;"5,079745";"5,079917";;"0,000172";;"-0,000662";"0,000834";"0,001496"
166;5.079.917;"5,079917";"192,168,100,98";"104,22,1,235";TCP;54;56807  >  443 [ACK] Seq=1070 Ack=1026 Win=130560 Len=0;;;"5,079917";"5,080751";;"0,000834";;"-0,045142";"0,045976";"0,091118"
167;5.080.751;"5,080751";"192,168,100,98";"104,22,1,235";TCP;54;"56807  >  443 [FIN, ACK] Seq=1070 Ack=1026 Win=130560 Len=0";;;"5,080751";"5,126727";;"0,045976";;"0,013951";"0,032025";"0,018074"
168;5.126.727;"5,126727";"192,168,100,98";"104,22,1,235";TCP;66;56808  >  443 [SYN] Seq=0 Win=64240 Len=0 MSS=1460 WS=256 SACK_PERM=1;;;"5,126727";"5,158752";;"0,032025";;"-0,015448";"0,047473";"0,062921"
169;5.158.752;"5,158752";"104,22,1,235";"192,168,100,98";TCP;56;443  >  56807 [ACK] Seq=1026 Ack=1071 Win=68608 Len=0;;;"5,158752";"5,206225";;"0,047473";;"0,047255";"0,000218";"-0,047037"
170;5.206.225;"5,206225";"104,22,1,235";"192,168,100,98";TCP;66;"443  >  56808 [SYN, ACK] Seq=0 Ack=1 Win=65535 Len=0 MSS=1400 SACK_PERM=1 WS=1024";;;"5,206225";"5,206443";;"0,000218";;"-0,000621";"0,000839";"0,00146"
171;5.206.443;"5,206443";"192,168,100,98";"104,22,1,235";TCP;54;56808  >  443 [ACK] Seq=1 Ack=1 Win=131584 Len=0;;;"5,206443";"5,207282";;"0,000839";;"-0,065296";"0,066135";"0,131431"
172;5.207.282;"5,207282";"192,168,100,98";"104,22,1,235";TLSv1;372;Client Hello;;;"5,207282";"5,273417";;"0,066135";;"0,05328";"0,012855";"-0,040425"
173;5.273.417;"5,273417";"104,22,1,235";"192,168,100,98";TCP;54;443  >  56808 [ACK] Seq=1 Ack=319 Win=67584 Len=0;;;"5,273417";"5,286272";;"0,012855";;"0,010969";"0,001886";"-0,009083"
174;5.286.272;"5,286272";"104,22,1,235";"192,168,100,98";TLSv1;177;"Server Hello, Change Cipher Spec, Encrypted Handshake Message";;;"5,286272";"5,288158";;"0,001886";;"-0,035119";"0,037005";"0,072124"
175;5.288.158;"5,288158";"192,168,100,98";"104,22,1,235";TLSv1;699;"Change Cipher Spec, Encrypted Handshake Message, Application Data, Application Data";;;"5,288158";"5,325163";;"0,037005";;"0,036846";"0,000159";"-0,036687"
176;5.325.163;"5,325163";"192,168,100,98";"74,125,68,91";"TLSv1,2";187;Application Data;;;"5,325163";"5,325322";;"0,000159";;"-0,022774";"0,022933";"0,045707"
177;5.325.322;"5,325322";"192,168,100,98";"74,125,68,91";"TLSv1,2";734;Application Data;;;"5,325322";"5,348255";;"0,022933";;"0,022808";"0,000125";"-0,022683"
178;5.348.255;"5,348255";"104,22,1,235";"192,168,100,98";TCP;56;443  >  56808 [ACK] Seq=124 Ack=964 Win=68608 Len=0;;;"5,348255";"5,348380";;"0,000125";;"-0,024796";"0,024921";"0,049717"
179;5.348.380;"5,348380";"192,168,100,98";"104,22,1,235";TLSv1;160;"Application Data, Application Data";;;"5,348380";"5,373301";;"0,024921";;"0,024717";"0,000204";"-0,024513"
180;5.373.301;"5,373301";"74,125,68,91";"192,168,100,98";TCP;56;443  >  56441 [ACK] Seq=181 Ack=963 Win=1651 Len=0;;;"5,373301";"5,373505";;"0,000204";;"-0,000699";"0,000903";"0,001602"
181;5.373.505;"5,373505";"74,125,68,91";"192,168,100,98";TCP;56;443  >  56441 [ACK] Seq=181 Ack=1643 Win=1662 Len=0;;;"5,373505";"5,374408";;"0,000903";;"0,000903";0;"-0,000903"
182;5.374.408;"5,374408";"74,125,68,91";"192,168,100,98";"TLSv1,2";127;Application Data;;;"5,374408";"5,374408";;0;;"-0,000139";"0,000139";"0,000278"
183;5.374.408;"5,374408";"74,125,68,91";"192,168,100,98";"TLSv1,2";116;Application Data;;;"5,374408";"5,374547";;"0,000139";;"-0,017264";"0,017403";"0,034667"
184;5.374.547;"5,374547";"192,168,100,98";"74,125,68,91";TCP;54;56441  >  443 [ACK] Seq=1643 Ack=316 Win=4133 Len=0;;;"5,374547";"5,391950";;"0,017403";;"0,017403";0;"-0,017403"
185;5.391.950;"5,391950";"74,125,68,91";"192,168,100,98";"TLSv1,2";85;Application Data;;;"5,391950";"5,391950";;0;;"-0,000184";"0,000184";"0,000368"
186;5.391.950;"5,391950";"74,125,68,91";"192,168,100,98";"TLSv1,2";93;Application Data;;;"5,391950";"5,392134";;"0,000184";;"-0,00068";"0,000864";"0,001544"
187;5.392.134;"5,392134";"192,168,100,98";"74,125,68,91";TCP;54;56441  >  443 [ACK] Seq=1643 Ack=386 Win=4133 Len=0;;;"5,392134";"5,392998";;"0,000864";;"-0,012761";"0,013625";"0,026386"
188;5.392.998;"5,392998";"192,168,100,98";"74,125,68,91";"TLSv1,2";93;Application Data;;;"5,392998";"5,406623";;"0,013625";;"0,007709";"0,005916";"-0,001793"
189;5.406.623;"5,406623";"104,22,1,235";"192,168,100,98";TCP;56;443  >  56808 [ACK] Seq=124 Ack=1070 Win=68608 Len=0;;;"5,406623";"5,412539";;"0,005916";;"-0,217908";"0,223824";"0,441732"
190;5.412.539;"5,412539";"74,125,68,91";"192,168,100,98";TCP;56;443  >  56441 [ACK] Seq=386 Ack=1682 Win=1662 Len=0;;;"5,412539";"5,636363";;"0,223824";;"0,223723";"0,000101";"-0,223622"
191;5.636.363;"5,636363";"104,22,1,235";"192,168,100,98";TCP;54;"[TCP Previous segment not captured] 443  >  56808 [FIN, ACK] Seq=1025 Ack=1070 Win=68608 Len=0";;;"5,636363";"5,636464";;"0,000101";;"-0,009735";"0,009836";"0,019571"
192;5.636.464;"5,636464";"192,168,100,98";"104,22,1,235";TCP;54;[TCP Dup ACK 175#1] 56808  >  443 [ACK] Seq=1070 Ack=124 Win=131328 Len=0;;;"5,636464";"5,646300";;"0,009836";;"0,009655";"0,000181";"-0,009474"
193;5.646.300;"5,646300";"104,22,1,235";"192,168,100,98";TCP;955;"[TCP Out-Of-Order] 443  >  56808 [PSH, ACK] Seq=124 Ack=1070 Win=68608 Len=901";;;"5,646300";"5,646481";;"0,000181";;"-0,000616";"0,000797";"0,001413"
194;5.646.481;"5,646481";"192,168,100,98";"104,22,1,235";TCP;54;56808  >  443 [ACK] Seq=1070 Ack=1026 Win=130560 Len=0;;;"5,646481";"5,647278";;"0,000797";;"-0,046353";"0,04715";"0,093503"
195;5.647.278;"5,647278";"192,168,100,98";"104,22,1,235";TCP;54;"56808  >  443 [FIN, ACK] Seq=1070 Ack=1026 Win=130560 Len=0";;;"5,647278";"5,694428";;"0,04715";;"0,019854";"0,027296";"0,007442"
196;5.694.428;"5,694428";"104,22,1,235";"192,168,100,98";TCP;56;443  >  56808 [ACK] Seq=1026 Ack=1071 Win=68608 Len=0;;;"5,694428";"5,721724";;"0,027296";;"-0,025602";"0,052898";"0,0785"
197;5.721.724;"5,721724";"192,168,100,98";"104,22,1,235";TCP;66;56809  >  443 [SYN] Seq=0 Win=64240 Len=0 MSS=1460 WS=256 SACK_PERM=1;;;"5,721724";"5,774622";;"0,052898";;"0,052653";"0,000245";"-0,052408"
198;5.774.622;"5,774622";"104,22,1,235";"192,168,100,98";TCP;66;"443  >  56809 [SYN, ACK] Seq=0 Ack=1 Win=65535 Len=0 MSS=1400 SACK_PERM=1 WS=1024";;;"5,774622";"5,774867";;"0,000245";;"-0,000621";"0,000866";"0,001487"
199;5.774.867;"5,774867";"192,168,100,98";"104,22,1,235";TCP;54;56809  >  443 [ACK] Seq=1 Ack=1 Win=131584 Len=0;;;"5,774867";"5,775733";;"0,000866";;"-0,051012";"0,051878";"0,10289"
200;5.775.733;"5,775733";"192,168,100,98";"104,22,1,235";TLSv1;372;Client Hello;;;"5,775733";"5,827611";;"0,051878";;"0,032241";"0,019637";"-0,012604"
201;5.827.611;"5,827611";"104,22,1,235";"192,168,100,98";TCP;54;443  >  56809 [ACK] Seq=1 Ack=319 Win=67584 Len=0;;;"5,827611";"5,847248";;"0,019637";;"0,017184";"0,002453";"-0,014731"
202;5.847.248;"5,847248";"104,22,1,235";"192,168,100,98";TLSv1;177;"Server Hello, Change Cipher Spec, Encrypted Handshake Message";;;"5,847248";"5,849701";;"0,002453";;"-0,050434";"0,052887";"0,103321"
203;5.849.701;"5,849701";"192,168,100,98";"104,22,1,235";TLSv1;699;"Change Cipher Spec, Encrypted Handshake Message, Application Data, Application Data";;;"5,849701";"5,902588";;"0,052887";;"0,052786";"0,000101";"-0,052685"
204;5.902.588;"5,902588";"104,22,1,235";"192,168,100,98";TCP;56;443  >  56809 [ACK] Seq=124 Ack=964 Win=68608 Len=0;;;"5,902588";"5,902689";;"0,000101";;"-0,275951";"0,276052";"0,552003"
205;5.902.689;"5,902689";"192,168,100,98";"104,22,1,235";TLSv1;160;"Application Data, Application Data";;;"5,902689";"6,178741";;"0,276052";;"0,215478";"0,060574";"-0,154904"
206;6.178.741;"6,178741";"192,168,100,98";"104,22,1,235";TCP;160;"[TCP Retransmission] 56809  >  443 [PSH, ACK] Seq=964 Ack=124 Win=131328 Len=106";;;"6,178741";"6,239315";;"0,060574";;"-0,033913";"0,094487";"0,1284"
207;6.239.315;"6,239315";"104,22,1,235";"192,168,100,98";TCP;56;443  >  56809 [ACK] Seq=124 Ack=1070 Win=68608 Len=0;;;"6,239315";"6,333802";;"0,094487";;"0,06698";"0,027507";"-0,039473"
208;6.333.802;"6,333802";"192,168,100,98";"103,208,137,6";TCP;55;55911  >  443 [ACK] Seq=1 Ack=1 Win=512 Len=1 [TCP segment of a reassembled PDU];;;"6,333802";"6,361309";;"0,027507";;"-0,089635";"0,117142";"0,206777"
209;6.361.309;"6,361309";"103,208,137,6";"192,168,100,98";TCP;66;443  >  55911 [ACK] Seq=1 Ack=2 Win=501 Len=0 SLE=1 SRE=2;;;"6,361309";"6,478451";;"0,117142";;"0,117042";"0,0001";"-0,116942"
210;6.478.451;"6,478451";"104,22,1,235";"192,168,100,98";TCP;54;"[TCP Previous segment not captured] 443  >  56809 [FIN, ACK] Seq=1025 Ack=1070 Win=68608 Len=0";;;"6,478451";"6,478551";;"0,0001";;"-0,017939";"0,018039";"0,035978"
211;6.478.551;"6,478551";"192,168,100,98";"104,22,1,235";TCP;54;[TCP Dup ACK 203#1] 56809  >  443 [ACK] Seq=1070 Ack=124 Win=131328 Len=0;;;"6,478551";"6,496590";;"0,018039";;"0,017871";"0,000168";"-0,017703"
212;6.496.590;"6,496590";"104,22,1,235";"192,168,100,98";TCP;955;"[TCP Out-Of-Order] 443  >  56809 [PSH, ACK] Seq=124 Ack=1070 Win=68608 Len=901";;;"6,496590";"6,496758";;"0,000168";;"-0,000565";"0,000733";"0,001298"
213;6.496.758;"6,496758";"192,168,100,98";"104,22,1,235";TCP;54;56809  >  443 [ACK] Seq=1070 Ack=1026 Win=130560 Len=0;;;"6,496758";"6,497491";;"0,000733";;"-0,101118";"0,101851";"0,202969"
214;6.497.491;"6,497491";"192,168,100,98";"104,22,1,235";TCP;54;"56809  >  443 [FIN, ACK] Seq=1070 Ack=1026 Win=130560 Len=0";;;"6,497491";"6,599342";;"0,101851";;"0,101756";"9,5E-05";"-0,101661"
215;6.599.342;"6,599342";"104,22,1,235";"192,168,100,98";TCP;54;"[TCP Retransmission] 443  >  56809 [FIN, ACK] Seq=1025 Ack=1070 Win=68608 Len=0";;;"6,599342";"6,599437";;"9,5E-05";;"-0,004879";"0,004974";"0,009853"
216;6.599.437;"6,599437";"192,168,100,98";"104,22,1,235";TCP;54;[TCP Dup ACK 213#1] 56809  >  443 [ACK] Seq=1071 Ack=1026 Win=130560 Len=0;;;"6,599437";"6,604411";;"0,004974";;"-0,048773";"0,053747";"0,10252"
217;6.604.411;"6,604411";"192,168,100,98";"104,22,1,235";TCP;66;56810  >  443 [SYN] Seq=0 Win=64240 Len=0 MSS=1460 WS=256 SACK_PERM=1;;;"6,604411";"6,658158";;"0,053747";;"0,053543";"0,000204";"-0,053339"
218;6.658.158;"6,658158";"104,22,1,235";"192,168,100,98";TCP;66;"443  >  56810 [SYN, ACK] Seq=0 Ack=1 Win=65535 Len=0 MSS=1400 SACK_PERM=1 WS=1024";;;"6,658158";"6,658362";;"0,000204";;"-0,000759";"0,000963";"0,001722"
219;6.658.362;"6,658362";"192,168,100,98";"104,22,1,235";TCP;54;56810  >  443 [ACK] Seq=1 Ack=1 Win=131584 Len=0;;;"6,658362";"6,659325";;"0,000963";;"-0,050664";"0,051627";"0,102291"
220;6.659.325;"6,659325";"192,168,100,98";"104,22,1,235";TLSv1;372;Client Hello;;;"6,659325";"6,710952";;"0,051627";;"0,031408";"0,020219";"-0,011189"
